COMP;REGIAO;UF;MUNICIPIO;NOME_ESTABELECIMENTO;RAZAO_SOCIAL;DS_TIPO_UNIDADE;DESC_NATUREZA_JURIDICA;NO_LOGRADOURO;NU_ENDERECO;NO_BAIRRO;CO_CEP;LEITOS_EXISTENTES;LEITOS_SUS;UTI_TOTAL_EXIST;UTI_TOTAL_SUS;UTI_ADULTO_EXIST;UTI_ADULTO_SUS;UTI_PEDIATRICO_EXIST;UTI_PEDIATRICO_SUS;UTI_NEONATAL_EXIST;UTI_NEONATAL_SUS;UTI_QUEIMADO_EXIST;UTI_QUEIMADO_SUS;UTI_CORONARIANA_EXIST;UTI_CORONARIANA_SUS
202302;SUDESTE;SP;SAO PAULO;HOSPITAL GERAL DE VILA PENTEADO DR JOSE PANGELLA SAO PAULO;SECRETARIA DE ESTADO DA SAUDE DE SAO PAULO;HOSPITAL GERAL;HOSPITAL_PÚBLICO;AV MINISTRO PETRONIO PORTELA;1642;JARDIM IRACEMA;2802120;268;259;35;35;20;20;5;5;4;4;6;6;0;0
202302;SUDESTE;SP;SAO PAULO;HOSP VERA CRUZ;HOSPITAL VERA CRUZ LTDA;HOSPITAL ESPECIALIZADO;HOSPITAL_PRIVADO;R ALTO PARAGUAI;362;J MODELO;2238240;130;0;0;0;0;0;0;0;0;0;0;0;0;0
202302;SUDESTE;SP;SAO PAULO;HOSPITAL CENTRAL DE GUAIANASES;HOSPITAL E PRONTO SOCORRO COMUNITARIO VILA IOLANDA LTDA;HOSPITAL GERAL;HOSPITAL_PRIVADO;RUA CABO JOSE TEIXEIRA;189;GUAIANAZES;8451010;95;0;13;0;13;0;0;0;0;0;0;0;0;0
202302;SUDESTE;SP;SAO PAULO;NEXT HOSPITAL SANTO AMARO;HOSPITAL ALVORADA TAGUATINGA LTDA;HOSPITAL GERAL;HOSPITAL_PRIVADO;RUA BARAO DO RIO BRANCO;555;SANTO AMARO;4753001;78;0;10;0;10;0;0;0;0;0;0;0;0;0
202302;SUDESTE;SP;SAO PAULO;HOSPITAL PSIQUIATRICO DE VILA MARIANA;SECRETARIA DE ESTADO DA SAUDE DE SAO PAULO;HOSPITAL ESPECIALIZADO;HOSPITAL_PÚBLICO;RUA MAJOR MARAGLIANO;241;VILA MARIANA;4017030;77;77;0;0;0;0;0;0;0;0;0;0;0;0
202302;SUDESTE;SP;SAO PAULO;CASA DE DAVID SAO PAULO;CASA DE DAVID TABERNACULO ESPIRITA PARA EXCEPCIONAIS;HOSPITAL ESPECIALIZADO;HOSPITAL_FILANTRÓPICO;RODOVIA FERNAO DIAS;82;PARQUE EDU CHAVES;2284000;281;265;0;0;0;0;0;0;0;0;0;0;0;0
202302;SUDESTE;SP;SAO PAULO;HOSPITAL SAO CAMILO POMPEIA;SOCIEDADE BENEFICENTE SAO CAMILO;HOSPITAL GERAL;HOSPITAL_FILANTRÓPICO;AV POMPEIA;1178;POMPEIA;5022001;385;0;103;0;86;0;17;0;0;0;0;0;0;0
202302;SUDESTE;SP;SAO PAULO;HOSPITAL GERAL DE VILA NOVA CACHOEIRINHA SAO PAULO;SECRETARIA DE ESTADO DA SAUDE DE SAO PAULO;HOSPITAL GERAL;HOSPITAL_PÚBLICO;AV DEPUTADO EMILIO CARLOS;3000;VILA NOVA CACHOEIRIN;2720200;210;195;40;30;40;30;0;0;0;0;0;0;0;0
202302;SUDESTE;SP;SAO PAULO;HOSPITAL GERIATRICO E DE CONVALESCENTES D PEDRO II;IRMANDADE SANTA CASA DE MISERICORDIA DE SAO PAULO;HOSPITAL GERAL;HOSPITAL_FILANTRÓPICO;AV GUAPIRA;2674;JACANA;2265002;457;457;0;0;0;0;0;0;0;0;0;0;0;0
202302;SUDESTE;SP;SAO PAULO;HOSPITAL SANTA CATARINA;ASSOCIACAO CONGREGACAO DESANTA CATARINA;HOSPITAL GERAL;HOSPITAL_FILANTRÓPICO;PAULISTA;200;BELA VISTA;1310000;316;0;79;0;63;0;16;0;0;0;0;0;0;0
202302;SUDESTE;SP;SAO PAULO;SAO LUIZ UNIDADE ITAIM;REDE D OR SAO LUIZ S A;HOSPITAL GERAL;HOSPITAL_PRIVADO;RUA DR ALCEU DE CAMPOS RODRIGUES;95;VILA NOVA CONCEICAO;4544000;274;0;50;0;18;0;0;0;32;0;0;0;0;0
202302;SUDESTE;SP;SAO PAULO;INST SUEL ABUJAMRA;INSTITUTO SUEL ABUJAMRA;HOSPITAL ESPECIALIZADO;HOSPITAL_FILANTRÓPICO;RUA TAMANDARE;693;ACLIMACAO;1525001;16;16;0;0;0;0;0;0;0;0;0;0;0;0
202302;SUDESTE;SP;SAO PAULO;SANTA CASA DE SAO PAULO HOSPITAL CENTRAL SAO PAULO;IRMANDADE DA SANTA CASA DE MISERICORDIA DE SAO PAULO;HOSPITAL GERAL;HOSPITAL_FILANTRÓPICO;RUA DR CESARIO MOTA JUNIOR;112;VILA BUARQUE;1221020;1086;1078;96;88;63;55;18;18;15;15;0;0;0;0
202302;SUDESTE;SP;SAO PAULO;HOSP DO SERV PUB MUNICIPAL HSPM;HOSPITAL DO SERVIDOR PUBLICO MUNICIPAL;HOSPITAL GERAL;HOSPITAL_PÚBLICO;CASTRO ALVES;60;LIBERDADE;1532000;190;14;42;14;33;10;4;0;5;4;0;0;0;0
202302;SUDESTE;SP;SAO PAULO;HOSP MUN FERNANDO MAURO PIRES DA ROCHA;PREFEITURA DO MUNICIPIO DE SAO PAULO;HOSPITAL GERAL;HOSPITAL_PÚBLICO;ESTRADA DE ITAPECERICA;1661;CAMPO LIMPO;5835005;327;303;68;60;40;40;16;10;12;10;0;0;0;0
202302;SUDESTE;SP;SAO PAULO;FUNDACAO FACULDADE DE MEDICINAHCFMUSP INST DE PSIQUIATRIA SP;FUNDACAO FACULDADE DE MEDICINA MECMPAS;HOSPITAL ESPECIALIZADO;HOSPITAL_FILANTRÓPICO;RUA DR OVIDIO PIRES DE CAMPOS;785;CERQUEIRA CESAR;5403000;123;123;0;0;0;0;0;0;0;0;0;0;0;0
202302;SUDESTE;SP;SAO PAULO;SERRA MAYOR;SERRA MAYOR SERVICOS MEDICOS S A;HOSPITAL GERAL;HOSPITAL_PRIVADO;ESTRADA DE ITAPECERICA;4659;CAPAO REDONDO;5858001;42;0;20;0;20;0;0;0;0;0;0;0;0;0
202302;SUDESTE;SP;SAO PAULO;API ASSISTENCIA PSIQUIATRICA INTEGRADA;API ASSISTENCIA PSIQUIATRICA INTEGRADA;HOSPITAL ESPECIALIZADO;HOSPITAL_PRIVADO;AV INDIANOPOLIS;1903;PLANALTO PAULISTA;4063003;51;0;0;0;0;0;0;0;0;0;0;0;0;0
202302;SUDESTE;SP;SAO PAULO;HOSPITAL E PRONTO SOCORRO PORTINARI;HOSPITAL E PRONTO SOCORRO PORTINARI LTDA;HOSPITAL GERAL;HOSPITAL_PRIVADO;AVENIDA CANDIDO PORTINARI;455;VILA JAGUARA;5114000;109;0;42;0;22;0;10;0;10;0;0;0;0;0
202302;SUDESTE;SP;SAO PAULO;HOSPITAL BDW SP;HOSPITAL BDW SP LTDA;HOSPITAL GERAL;HOSPITAL_PRIVADO;AV DOS BANDEIRANTES;679;VILA OLIMPIA;4553010;29;0;10;0;10;0;0;0;0;0;0;0;0;0
202302;SUDESTE;SP;SAO PAULO;CENTRO HOSPITALAR DO SISTEMA PENITENCIARIO SAO PAULO;SECRETARIA DE ESTADO DA SAUDE DE SAO PAULO;HOSPITAL GERAL;HOSPITAL_PÚBLICO;RUA DOM JOSE MAURICIO;15;CARANDIRU;2028000;251;251;0;0;0;0;0;0;0;0;0;0;0;0
202302;SUDESTE;SP;SAO PAULO;HOSP DE CLINICAS J HELENA;HOSPITAL DE CLINICAS JARDIM HELENA SC LTDA;HOSPITAL GERAL;HOSPITAL_PRIVADO;RUA ERVA ANDORINHA;123;JARDIM HELENA;8090470;32;0;8;0;8;0;0;0;0;0;0;0;0;0
202302;SUDESTE;SP;SAO PAULO;HOSPITAL SAO CAMILO IPIRANGA;SOCIEDADE BENEFICENTE SAO CAMILO;HOSPITAL GERAL;HOSPITAL_FILANTRÓPICO;RUA POUSO ALEGRE;1;IPIRANGA;4261030;162;0;48;0;48;0;0;0;0;0;0;0;0;0
202302;SUDESTE;SP;SAO PAULO;HSANP HOSPITAL;ASSOCIACAO HOSPITALAR SANTANA;HOSPITAL GERAL;HOSPITAL_FILANTRÓPICO;R VOLUNTARIOS DA PATRIA;2786;SANTANA;2402100;152;0;39;0;20;0;9;0;10;0;0;0;0;0
202302;SUDESTE;SP;SAO PAULO;MASTER CLIN;HOSPITAL E MATERNIDADE MASTER CLIN SC LTDA;HOSPITAL GERAL;HOSPITAL_PRIVADO;RUA DR GALVAO GUIMARAES;72;SAO MATEUS;3970040;62;0;10;0;0;0;0;0;10;0;0;0;0;0
202302;SUDESTE;SP;SAO PAULO;PRO MATRE PAULISTA;HOSPITAL E MATERNIDADE SANTA JOANA S A;HOSPITAL ESPECIALIZADO;HOSPITAL_PRIVADO;SAO CARLOS DO PINHAL;139;BELA VISTA;1333001;229;0;66;0;3;0;0;0;63;0;0;0;0;0
202302;SUDESTE;SP;SAO PAULO;HOSPITAL SAO CAMILO SANTANA;SOCIEDADE BENEFICENTE SAO CAMILO;HOSPITAL GERAL;HOSPITAL_FILANTRÓPICO;RUA DR LUIS LUSTOSA DA SILVA;33;SANTANA;2406040;243;0;61;0;50;0;11;0;0;0;0;0;0;0
202302;SUDESTE;SP;SAO PAULO;HOSP DE OLHOS DE SAO PAULO;UNIDADE OFTALMOLOGICA DE SANTANA;HOSPITAL ESPECIALIZADO;HOSPITAL_PRIVADO;AVN CANTAREIRA;126;SANTANA;2330000;26;0;0;0;0;0;0;0;0;0;0;0;0;0
202302;SUDESTE;SP;SAO PAULO;HOSPITAL E MATERNIDADE VIDAS;HOSPITAL E MATERNIDADE VIDAS LTDA;HOSPITAL GERAL;HOSPITAL_PRIVADO;NOSSA SENHORA DO SABARA;2375;VILA CAMPO GRANDE;4685006;44;0;13;0;0;0;8;0;5;0;0;0;0;0
202302;SUDESTE;SP;SAO PAULO;CEMA HOSP ESPEC;CEMA HOSPITAL ESPECIALIZADO LIMITADA;HOSPITAL ESPECIALIZADO;HOSPITAL_PRIVADO;RUA PADRE ADELINO;333;QUARTA PARADA;3303000;169;0;0;0;0;0;0;0;0;0;0;0;0;0
202302;SUDESTE;SP;SAO PAULO;CLINICA INFANTIL SANTA ISABELLA;CLINICA INFANTIL SANTA ISABELLA S S;PRONTO SOCORRO ESPECIALIZADO;HOSPITAL_PRIVADO;RUA VERBO DIVINO;246;GRANJA JULIETA;4719000;3;0;0;0;0;0;0;0;0;0;0;0;0;0
202302;SUDESTE;SP;SAO PAULO;EYE CLINIC IBIRAPUERA;EYE CLINIC OFTALMOLOGIA CLINICO CIRURGICA E DIAGNOSTICA LTDA;HOSPITAL ESPECIALIZADO;HOSPITAL_PRIVADO;AVENIDA REPUBLICA DO LIBANO;1034;IBIRAPUERA;4502001;16;0;0;0;0;0;0;0;0;0;0;0;0;0
202302;SUDESTE;SP;SAO PAULO;HOSPITAL ADVENTISTA DE SAO PAULO;INSTITUICAO PAULISTA ADVENTISTA DE EDUCACAO E ASSIST SOCIAL;HOSPITAL GERAL;HOSPITAL_FILANTRÓPICO;RUA ROCHA POMBO;49;LIBERDADE;1525010;47;0;7;0;7;0;0;0;0;0;0;0;0;0
202302;SUDESTE;SP;SAO PAULO;HOSP MUN VER JOSE STOROPOLLI;PREFEITURA DO MUNICIPIO DE SAO PAULO;HOSPITAL GERAL;HOSPITAL_PÚBLICO;RUA FRANCISCO FANGANIELLO;127;PARQUE NOVO MUNDO;2181160;201;181;40;20;30;10;5;5;5;5;0;0;0;0
202302;SUDESTE;SP;SAO PAULO;CLINICA ESPEC RENAITRE;RENAITRE CLINICA DE ESTETICA LTDA;HOSPITAL ESPECIALIZADO;HOSPITAL_PRIVADO;RUA JOSE PEREIRA CARDOSO;80;SAO MIGUEL PAULISTA;8011310;6;0;0;0;0;0;0;0;0;0;0;0;0;0
202302;SUDESTE;SP;SAO PAULO;HOSPITAL BOSQUE DA SAUDE;NOTRE DAME INTERMEDICA SAUDE S A;HOSPITAL GERAL;HOSPITAL_PRIVADO;AV BOSQUE DA SAUDE;1926;SAUDE;4142082;141;0;17;0;17;0;0;0;0;0;0;0;0;0
202302;SUDESTE;SP;SAO PAULO;HOSPITAL DA LUZ 113;AMICO SAUDE LTDA;HOSPITAL GERAL;HOSPITAL_PRIVADO;RUA AZEVEDO DE MACEDO;113;JARDIM ZAIRA;4013060;143;0;40;0;40;0;0;0;0;0;0;0;0;0
202302;SUDESTE;SP;SAO PAULO;CENTRO MEDICO PMESP;POLICIA MILITAR DO ESTADO DE SAO PAULO;HOSPITAL GERAL;HOSPITAL_PÚBLICO;AVENIDA NOVA CANTAREIRA;3659;TREMEMBE;2341001;95;0;10;0;10;0;0;0;0;0;0;0;0;0
202302;SUDESTE;SP;SAO PAULO;PREMIER RESIDENCE HOSPITAL;PREMIER RESIDENCE HOSPITAL LTDA ME;HOSPITAL GERAL;HOSPITAL_PRIVADO;RUA JURUBATUBA;461;VILA CORDEIRO;4583100;74;0;0;0;0;0;0;0;0;0;0;0;0;0
202302;SUDESTE;SP;SAO PAULO;SAHA SERVICOS MEDICOS E HOSPITALARES;SAHA SERVICOS MEDICOS E HOSPITALARES LTDA;HOSPITAL GERAL;HOSPITAL_PRIVADO;RUA MAESTRO CARDIM;407;BELA VISTA;1323000;10;0;2;0;2;0;0;0;0;0;0;0;0;0
202302;SUDESTE;SP;SAO PAULO;HOSPITAL PARANAGUA;HOSPITAL VITAL LTDA;HOSPITAL GERAL;HOSPITAL_PRIVADO;AVENIDA PARANAGUA;808;VILA PARANAGUA;3806000;25;0;0;0;0;0;0;0;0;0;0;0;0;0
202302;SUDESTE;SP;SAO PAULO;CLINICA MEDICA NOSSA SENHORA LURDES;CLINICA MEDICA NOSSA SENHORA LURDES LTDA;HOSPITAL ESPECIALIZADO;HOSPITAL_PRIVADO;AVENIDA SANATORIO;149;JARDIM BRASIL;2238000;5;0;0;0;0;0;0;0;0;0;0;0;0;0
202302;SUDESTE;SP;SAO PAULO;HOSP E MAT JARDINS;HOSPITAL E MATERNIDADE JARDINS LTDA;HOSPITAL GERAL;HOSPITAL_PRIVADO;RUA ARTUR AZEVEDO;1659;PINHEIROS;5404014;47;0;10;0;6;0;0;0;4;0;0;0;0;0
202302;SUDESTE;SP;SAO PAULO;HOSP E MAT STO EXPEDITO;SOMEL SOCIEDADE PARA MEDICINA LESTE LTDA;HOSPITAL GERAL;HOSPITAL_PRIVADO;RUA TOMOICHI SHIMIZU;201;ITAQUERA;8260140;31;0;6;0;6;0;0;0;0;0;0;0;0;0
202302;SUDESTE;SP;SAO PAULO;HOSPITAL SILVIO ROMERO;HOSPITAL DE ESPECIALIDADES SILVIO ROMERO LTDA;HOSPITAL GERAL;HOSPITAL_PRIVADO;RUA FERNANDES PINHEIRO;268;VILA AZEVEDO;3308060;120;0;10;0;10;0;0;0;0;0;0;0;0;0
202302;SUDESTE;SP;SAO PAULO;SAO LUIZ UNIDADE MORUMBI;REDE D OR SAO LUIZ S A;HOSPITAL GERAL;HOSPITAL_PRIVADO;RUA ENGENHEIRO OSCAR AMERICANO;840;MORUMBI;5673050;187;0;60;0;39;0;10;0;0;0;0;0;11;0
202302;SUDESTE;SP;SAO PAULO;HOSPITAL DOM PEDRO;ACEBRAS SERVICOS MEDICOS HOSPITALARES LTDA;HOSPITAL GERAL;HOSPITAL_PRIVADO;AV ALCANTARA MACHADO;60;BRAS;3102000;133;0;22;0;22;0;0;0;0;0;0;0;0;0
202302;SUDESTE;SP;SAO PAULO;HOSPITAL DA FACE;HOSPITAL DA FACE LTDA;HOSPITAL ESPECIALIZADO;HOSPITAL_PRIVADO;RUA IZONZO;155;SACOMA;4249000;5;0;0;0;0;0;0;0;0;0;0;0;0;0
202302;SUDESTE;SP;SAO PAULO;HOSPITAL INFANTIL SABARA UNIDADE 2;FUNDACAO JOSE LUIZ EGYDIO SETUBAL;HOSPITAL ESPECIALIZADO;HOSPITAL_FILANTRÓPICO;AVENIDA ANGELICA;1920;HIGIENOPOLIS;1228200;58;0;0;0;0;0;0;0;0;0;0;0;0;0
202302;SUDESTE;SP;SAO PAULO;HOSPITAL SANTA ISABEL;HOSPITAL SANTA ISABEL S A;HOSPITAL GERAL;HOSPITAL_PRIVADO;R DR CESARIO MOTA JUNIOR;112;SANTA CECILIA;1221900;115;0;19;0;12;0;0;0;0;0;3;0;4;0
202302;SUDESTE;SP;SAO PAULO;HOSPITAL INDIANOPOLIS;CARESURGE LTDA;HOSPITAL GERAL;HOSPITAL_PRIVADO;AVENIDA JANDIRA;1134;INDIANOPOLIS;4080006;40;0;0;0;0;0;0;0;0;0;0;0;0;0
202302;SUDESTE;SP;SAO PAULO;HOSPITAL SAN GENNARO;HOSPITAL SAN GENNARO LTDA;HOSPITAL GERAL;HOSPITAL_PRIVADO;PAES DE BARROS;1327;MOOCA;3115020;41;0;4;0;4;0;0;0;0;0;0;0;0;0
202302;SUDESTE;SP;SAO PAULO;NOTRA DAME INTERMEDICA SAUDE;NOTRE DAME INTERMEDICA SAUDE SA;UNIDADE MISTA;HOSPITAL_PRIVADO;AVENIDA REBOUCAS;2274;PINHEIROS;5402300;4;0;0;0;0;0;0;0;0;0;0;0;0;0
202302;SUDESTE;SP;SAO PAULO;HOSP MUN CARMEN PRUDENTE;PREFEITURA DO MUNICIPIO DE SAO PAULO;HOSPITAL GERAL;HOSPITAL_PÚBLICO;AV DOS METALURGICOS;1797;CIDADE TIRADENTES;8471000;245;224;51;30;30;10;11;10;10;10;0;0;0;0
202302;SUDESTE;SP;SAO PAULO;HOSPITAL LOCAL DE SAPOPEMBA;SECRETARIA DE ESTADO DA SAUDE DE SAO PAULO;HOSPITAL GERAL;HOSPITAL_PÚBLICO;RUA IAMACARU;45;PARQUE SANTA MADALEN;3982060;30;30;0;0;0;0;0;0;0;0;0;0;0;0
202302;SUDESTE;SP;SAO PAULO;INSTITUTO DE REABILITACAO LUCY MONTORO;SECRETARIA DE ESTADO DA SAUDE DE SAO PAULO;HOSPITAL ESPECIALIZADO;HOSPITAL_PÚBLICO;RUA JANDIATUBA;580;VILA ANDRADE;5716150;64;64;0;0;0;0;0;0;0;0;0;0;0;0
202302;SUDESTE;SP;SAO PAULO;HOSPITAL VILLA LOBOS;REDE DOR SAO LUIZ S A;HOSPITAL GERAL;HOSPITAL_PRIVADO;RUA LITUANIA;260;MOOCA;3184020;154;0;40;0;30;0;0;0;0;0;0;0;10;0
202302;SUDESTE;SP;SAO PAULO;ASSOCIACAO HOSPITAL PERSONAL CUIDADOS ESPECIAIS;ASSOCIACAO HOSPITAL PERSONAL CUIDADOS ESPECIAIS;HOSPITAL GERAL;HOSPITAL_FILANTRÓPICO;RUA CAME;1016;PARQUE DA MOOCA;3121020;70;0;0;0;0;0;0;0;0;0;0;0;0;0
202302;SUDESTE;SP;SAO PAULO;HOSPITAL INGLES;HOSPITAL INGLES LTDA;HOSPITAL ESPECIALIZADO;HOSPITAL_PRIVADO;RUA SILVIA;193;BELA VISTA;1331010;7;0;0;0;0;0;0;0;0;0;0;0;0;0
202302;SUDESTE;SP;SAO PAULO;BARRAMED CASA DE APOIO;BARRAMED CASA DE APOIO LTDA;HOSPITAL ESPECIALIZADO;HOSPITAL_PRIVADO;RUA PROFESSOR GIULIANI;202;VILA INVERNADA;3348030;25;0;0;0;0;0;0;0;0;0;0;0;0;0
202302;SUDESTE;SP;SAO PAULO;HOSP MUN M BOI MIRIM;SECRETARIA MUNICIPAL DA SAUDE;HOSPITAL GERAL;HOSPITAL_PÚBLICO;DO M BOI MIRIM;5203;JARDIM ANGELA;4948970;341;279;80;40;60;20;10;10;10;10;0;0;0;0
202302;SUDESTE;SP;SAO PAULO;HOSP SAO LUIZ ANALIA FRANCO;REDE DOR SAO LUIZ S A;HOSPITAL GERAL;HOSPITAL_PRIVADO;FRANCISCO MARENGO;1312;TATUAPE;3313000;259;0;85;0;54;0;11;0;20;0;0;0;0;0
202302;SUDESTE;SP;SAO PAULO;INSTITUTO DO CANCER DO ESTADO DE SAO PAULO;SECRETARIA DE ESTADO DA SAUDE DE SAO PAULO;HOSPITAL ESPECIALIZADO;HOSPITAL_PÚBLICO;AV DR ARNALDO;251;CERQUEIRA CESAR;1246000;525;525;85;85;85;85;0;0;0;0;0;0;0;0
202302;SUDESTE;SP;SAO PAULO;HOSPITAL MONTEMAGNO;NOTRE DAME INTERMEDICA SAUDE S A;HOSPITAL GERAL;HOSPITAL_PRIVADO;AVENIDA MONTEMAGNO;241;VILA FORMOSA;3371000;113;0;11;0;11;0;0;0;0;0;0;0;0;0
202302;SUDESTE;SP;SAO PAULO;HOSPITAL LEFORTE;HOSPITAL LEFORTE S A;HOSPITAL GERAL;HOSPITAL_PRIVADO;RUA TRES IRMAOS;121;CAXINGUI;5615190;96;0;28;0;16;0;8;0;4;0;0;0;0;0
202302;SUDESTE;SP;SAO PAULO;BP MIRANTE;REAL E BENEMERITA ASSOCIACAO PORTUGUESA DE BENEFICENCIA;HOSPITAL ESPECIALIZADO;HOSPITAL_FILANTRÓPICO;RUA MARTINIANO DE CARVALHO;965;BELA VISTA;1321001;123;0;30;0;30;0;0;0;0;0;0;0;0;0
202302;SUDESTE;SP;SAO PAULO;UNIDADE AVANCADA EINSTEIN PERDIZES;SOCIEDADE BENEF ISRAELITA BRAS HOSPITAL ALBERT EINSITEN;HOSPITAL GERAL;HOSPITAL_FILANTRÓPICO;RUA APIACAS;85;PERDIZES;5017020;9;0;0;0;0;0;0;0;0;0;0;0;0;0
202302;SUDESTE;SP;SAO PAULO;HOSPITAL INFANTIL SABARA;FUNDACAO JOSE LUIZ EGYDIO SETUBAL;HOSPITAL ESPECIALIZADO;HOSPITAL_FILANTRÓPICO;AVENIDA ANGELICA;1987;HIGIENOPOLIS;1227200;118;0;45;0;0;0;45;0;0;0;0;0;0;0
202302;SUDESTE;SP;SAO PAULO;HOSPITAL SANCTA MAGGIORE;PREVENT SENIOR PRIVATE OPERADORA DE SAUDE LTDA;HOSPITAL GERAL;HOSPITAL_PRIVADO;RUA MITUTO MUZUMOTO;596;LIBERDADE;1513040;4;0;0;0;0;0;0;0;0;0;0;0;0;0
202302;SUDESTE;SP;SAO PAULO;HOSPITAL VITORIA;ESHO EMPRESA DE SERVICOS HOSPITALARES SA;HOSPITAL GERAL;HOSPITAL_PRIVADO;AVN VEREADOR ABEL FERREIRA;S/N;J ANALIA FRANCO;3340000;152;0;48;0;34;0;4;0;10;0;0;0;0;0
202302;SUDESTE;SP;SAO PAULO;HOSPITAL E CASA DE REPOUSO SAINTE MARIE;HOSPITAL E CASA DE REPOUSO SAINTE MARIE LTDA;HOSPITAL GERAL;HOSPITAL_PRIVADO;GUILHERME ASBAHR NETO;438;CHACARA MONTE ALEGRE;4646001;46;0;0;0;0;0;0;0;0;0;0;0;0;0
202302;SUDESTE;SP;SAO PAULO;IBCC UNIDADE JACANA;INSTITUTO BRASILEIRO DE CONTROLE DO CANCER;HOSPITAL ESPECIALIZADO;HOSPITAL_FILANTRÓPICO;RUA ROQUE DE PAULA MONTEIRO;245;JACANA;2272000;128;0;0;0;0;0;0;0;0;0;0;0;0;0
202302;SUDESTE;SP;SAO PAULO;HOSPITAL MUNICIPAL SOROCABANA;PREFEITURA DO MUNICIPIO DE SAO PAULO;HOSPITAL GERAL;HOSPITAL_PÚBLICO;RUA FAUSTOLO;1633;VILA ROMANA;5041001;60;50;10;0;10;0;0;0;0;0;0;0;0;0
202302;SUDESTE;SP;SAO PAULO;HOSPITAL A C CAMARGO TAMANDARE;FUNDACAO ANTONIO PRUDENTE;HOSPITAL ESPECIALIZADO;HOSPITAL_FILANTRÓPICO;TAMANDARE;753;LIBERDADE;1525000;126;0;10;0;10;0;0;0;0;0;0;0;0;0
202302;SUDESTE;SP;SAO PAULO;HOSPITAL GREEN HILL;GREEN HILL SERVICOS MEDICOS SC LTDA;HOSPITAL GERAL;HOSPITAL_PRIVADO;RUA BOM PASTOR;905;IPIRANGA;4203050;12;0;0;0;0;0;0;0;0;0;0;0;0;0
202302;SUDESTE;SP;SAO PAULO;HOSPITAL E PRONTO ATENDIMENTO SANCTA MAGGIORE;PREVENT SENIOR PRIVATE OPERADORA DE SAUDE LTDA;HOSPITAL GERAL;HOSPITAL_PRIVADO;RUA TAMARATACA;127;MOOCA;3119010;66;0;10;0;10;0;0;0;0;0;0;0;0;0
202302;SUDESTE;SP;SAO PAULO;HOSPITAL SANCTA MAGGIORE;PREVENT SENIOR PRIVATE OPERADORA DE SAUDE LTDA;HOSPITAL GERAL;HOSPITAL_PRIVADO;AVENIDA SANTO AMARO;22;VILA NOVA CONCEICAO;4506000;97;0;18;0;18;0;0;0;0;0;0;0;0;0
202302;SUDESTE;SP;SAO PAULO;HOSPITAL E PRONTO ATENDIMENTO SANCTA MAGGIORE;PREVENT SENIOR PRIVATE OPERADORA DE SAUDE LTDA;HOSPITAL GERAL;HOSPITAL_PRIVADO;RUA DA FIGUEIRA;831;MOOCA;3102010;117;0;20;0;20;0;0;0;0;0;0;0;0;0
202302;SUDESTE;SP;SAO PAULO;HOSPITAL E PRONTO ATENDIMENTO SANCTA MAGGIORE;PREVENT SENIOR PRIVATE OPERADORA DE SAUDE LTDA;HOSPITAL GERAL;HOSPITAL_PRIVADO;RUA MAESTRO CARDIM;1137;BELA VISTA;1323001;106;0;30;0;30;0;0;0;0;0;0;0;0;0
202302;SUDESTE;SP;SAO PAULO;BENVISTA OFTALMOLOGIA;VMOFTSP CLINICA MEDICA OFTALMOLOGICA LTDA;HOSPITAL ESPECIALIZADO;HOSPITAL_PRIVADO;AV LEONCIO DE MAGALHAES;683;JARDIM SAO PAULO;2042010;26;0;0;0;0;0;0;0;0;0;0;0;0;0
202302;SUDESTE;SP;SAO PAULO;HOSPITAL PROFESSORA LYDIA STOROPOLI;ASSOCIACAO EDUCACIONAL NOVE DE JULHO;HOSPITAL GERAL;HOSPITAL_FILANTRÓPICO;VERGUEIRO;235;LIBERDADE;1504001;210;180;30;0;30;0;0;0;0;0;0;0;0;0
202302;SUDESTE;SP;SAO PAULO;HOSPITAL SANCTA MAGGIORE;PREVENT SENIOR PRIVATE OPERADORA DE SAUDE LTDA;HOSPITAL GERAL;HOSPITAL_PRIVADO;RUA CRISTIANO VIANA;890;PINHEIROS;5411001;101;0;29;0;29;0;0;0;0;0;0;0;0;0
202302;SUDESTE;SP;SAO PAULO;COMPLEXO HOSPITALAR SANTO EXPEDITO;SANTO ANDRE SERVICOS MEDICOS ESPECIALIZADOS LTDA;HOSPITAL GERAL;HOSPITAL_PRIVADO;RUA TOMOICHI SHIMIZU;201;ITAQUERA;8260140;38;0;8;0;8;0;0;0;0;0;0;0;0;0
202302;SUDESTE;SP;SAO PAULO;HOSPITAL SAINT PETER;MEJI ASSISTENCIA MEDICA LTDA;HOSPITAL GERAL;HOSPITAL_PRIVADO;RUA ESTADO DE ISRAEL;747;VILA CLEMENTINO;4022002;55;0;4;0;4;0;0;0;0;0;0;0;0;0
202302;SUDESTE;SP;SAO PAULO;CLINICA SPATIIUM;CLINICA MEDICA GLORIA TORQUATO LTDA;HOSPITAL ESPECIALIZADO;HOSPITAL_PRIVADO;RUA JOSE ANTONIO COELHO;416;VILA MARIANA;4011061;15;0;0;0;0;0;0;0;0;0;0;0;0;0
202302;SUDESTE;SP;SAO PAULO;HOSPITAL MORIAH;REDE MORIAH SAUDE LTDA;HOSPITAL GERAL;HOSPITAL_PRIVADO;AVENIDA MOACI;974;PLANALTO PAULISTA;4083002;43;0;5;0;5;0;0;0;0;0;0;0;0;0
202302;SUDESTE;SP;SAO PAULO;HOSPITAL SANTA CLARA;GERHOSP SERVICOS HOSPITALARES LTDA;HOSPITAL GERAL;HOSPITAL_PRIVADO;JOAQUIM MARRA;138;VILA MATILDE;3514000;159;0;27;0;27;0;0;0;0;0;0;0;0;0
202302;SUDESTE;SP;SAO PAULO;HOSP MUN GILSON DE CASSIA MARQUES DE CARVALHO;PREFEITURA DO MUNICIPIO DE SAO PAULO;HOSPITAL GERAL;HOSPITAL_PÚBLICO;AVENIDA SANTA CATARINA;2785;VILA MASCOTE;4378200;247;212;59;40;40;40;9;0;10;0;0;0;0;0
202302;SUDESTE;SP;SAO PAULO;HOSPITAL MUNICIPAL CAPELA DO SOCORRO;PREFEITURA DO MUNICIPIO DE SAO PAULO;HOSPITAL GERAL;HOSPITAL_PÚBLICO;RUA CASSIO DE CAMPOS NOGUEIRA;2031;JARDIM DAS IMBUIAS;4829310;105;95;10;0;10;0;0;0;0;0;0;0;0;0
202302;SUDESTE;SP;SAO PAULO;HOSPITAL SANCTA MAGGIORE;PREVENT SENIOR PRIVATE OPERADORA DE SAUDE LTDA;HOSPITAL GERAL;HOSPITAL_PRIVADO;RUA JUAGUARIBE;144;VILA BUARQUE;1224000;125;0;18;0;18;0;0;0;0;0;0;0;0;0
202302;SUDESTE;SP;SAO PAULO;BLA SERVICOS HOSPITALARES;BLA SERVICOS HOSPITALARES LTDA;HOSPITAL ESPECIALIZADO;HOSPITAL_PRIVADO;BRIG LUIS ANTONIO;3767;JARDIM PAULISTA;1401001;25;0;0;0;0;0;0;0;0;0;0;0;0;0
202302;SUDESTE;SP;SAO PAULO;CLINICA MEDICA ESPACO FIGUEIRA BRANCA;CLINICA MEDICA ESPACO FIGUEIRA BRANCA LTDA;UNIDADE MISTA;HOSPITAL_PRIVADO;DRONSFIELD;272;LAPA;5074000;30;0;0;0;0;0;0;0;0;0;0;0;0;0
202302;SUDESTE;SP;SAO PAULO;HOSP MUN JOSANIAS CASTANHA BRAGA;PREFEITURA DO MUNICIPIO DE SAOPAULO;HOSPITAL GERAL;HOSPITAL_PÚBLICO;RUA EUZEBIO COGHI;841;JARDIM ROSCHEL;4883290;282;237;40;20;20;10;10;10;10;0;0;0;0;0
202302;SUDESTE;SP;SAO PAULO;HOSPITAL E MATERNIDADE SANTA MARIA;HOSPITAL E MATERNIDADE SANTA JOANA S A;HOSPITAL ESPECIALIZADO;HOSPITAL_PRIVADO;LEONCIO DE CARVALHO;233;PARAISO;4003010;31;0;24;0;0;0;0;0;24;0;0;0;0;0
202302;SUDESTE;SP;SAO PAULO;HOSPITAL E MATERNIDADE SALVALUS;NOTRE DAME INTERMEDICA SAUDE S A;HOSPITAL GERAL;HOSPITAL_PRIVADO;RUA BRESSER;1954;BRAS;3161160;469;0;140;0;84;0;26;0;20;0;0;0;10;0
202302;SUDESTE;SP;SAO PAULO;JML SERVICOS HOSPITALARES;JML SERVICOS HOSPITALARES LTDA;HOSPITAL ESPECIALIZADO;HOSPITAL_PRIVADO;RUA JOSE MARIA LISBOA;659;JARDIM PAULISTA;1423001;45;0;0;0;0;0;0;0;0;0;0;0;0;0
202302;SUDESTE;SP;SAO PAULO;HOSPITAL SAMARITANO PAULISTA;HOSPITAL ALVORADA TAGUATINGA LTDA;HOSPITAL GERAL;HOSPITAL_PRIVADO;AVENIDA BRIGADEIRO LUIS ANTONIO;1895;BELA VISTA;1317002;110;0;27;0;27;0;0;0;0;0;0;0;0;0
202302;SUDESTE;SP;SAO PAULO;HOSPITAL VILA NOVA STAR;ONCO STAR SP ONCOLOGIA LTDA;HOSPITAL GERAL;HOSPITAL_PRIVADO;DOUTOR ALCEU DE CAMPOS RODRIGUES;126;VILA NOVA CONCEICAO;4544000;42;0;9;0;9;0;0;0;0;0;0;0;0;0
202302;SUDESTE;SP;SAO PAULO;HOSPITAL MUNICIPAL INTEGRADO SANTO AMARO;PREFEITURA DO MUNICIPIO DE SAO PAULO;HOSPITAL GERAL;HOSPITAL_PÚBLICO;AV ADOLFO PINHEIRO;339;SANTO AMARO;4753060;70;70;0;0;0;0;0;0;0;0;0;0;0;0
