COMP;REGIAO;UF;MUNICIPIO;NOME_ESTABELECIMENTO;RAZAO_SOCIAL;DS_TIPO_UNIDADE;DESC_NATUREZA_JURIDICA;NO_LOGRADOURO;NU_ENDERECO;NO_BAIRRO;CO_CEP;LEITOS_EXISTENTES;LEITOS_SUS;UTI_TOTAL_EXIST;UTI_TOTAL_SUS;UTI_ADULTO_EXIST;UTI_ADULTO_SUS;UTI_PEDIATRICO_EXIST;UTI_PEDIATRICO_SUS;UTI_NEONATAL_EXIST;UTI_NEONATAL_SUS;UTI_QUEIMADO_EXIST;UTI_QUEIMADO_SUS;UTI_CORONARIANA_EXIST;UTI_CORONARIANA_SUS
202302;SUDESTE;SP;SAO PAULO;HOSPITAL MUNICIPAL BELA VISTA SANTA DULCE DOS POBRES;PREFEITURA DO MUNICIPIO DE SAO PAULO;HOSPITAL GERAL;HOSPITAL_PÚBLICO;RUA ANTONIO CARLOS;122;CONSOLACAO;1309010;113;93;20;0;20;0;0;0;0;0;0;0;0;0
202302;SUDESTE;SP;SAO PAULO;HOSPITAL MUNICIPAL BRASILANDIA;PREFEITURA DO MUNICIPIO DE SAO PAULO;HOSPITAL GERAL;HOSPITAL_PÚBLICO;AVENIDA MICHIHISA MURATA;150;JARDIM MARISTELA;2806160;204;204;30;30;20;20;10;10;0;0;0;0;0;0
202302;SUDESTE;SP;SAO PAULO;HOSPITAL MUNICIPAL BRIGADEIRO;PREFEITURA DO MUNICIPIO DE SAO PAULO;HOSPITAL GERAL;HOSPITAL_PÚBLICO;AVENIDA BRIGADEIRO LUIS ANTONIO;4805;JARDIM PAULISTA;1401002;85;75;10;0;10;0;0;0;0;0;0;0;0;0
202302;SUDESTE;SP;SAO PAULO;HOSPITAL MUNICIPAL GUARAPIRANGA;PREFEITURA DO MUNICIPIO DE SAO PAULO;HOSPITAL GERAL;HOSPITAL_PÚBLICO;ESTRADA DA RIVIERA;4742;RIVIERA PAULISTA;4916000;186;156;30;0;30;0;0;0;0;0;0;0;0;0
202302;SUDESTE;SP;SAO PAULO;IMPAR SERVICOS HOSPITALARES FILIAL SANTA PAULA;IMPAR SERVICOS HOSPITALARES SA;HOSPITAL GERAL;HOSPITAL_PRIVADO;AVENIDA SANTO AMARO;2468;BROOKLIN PAULISTA;4556901;199;0;50;0;50;0;0;0;0;0;0;0;0;0
202302;SUDESTE;SP;SAO PAULO;HOSPITAL SANCTA MAGGIORE DUBAI;PREVENT SENIOR PRIVATE OPERADORA DE SAUDE LTDA;HOSPITAL GERAL;HOSPITAL_PRIVADO;RUA FRANCISCO TRAMONTANO;100;REAL PARQUE;5686902;170;0;37;0;37;0;0;0;0;0;0;0;0;0
202302;SUDESTE;SP;SAO PAULO;HOSPITAL E PRONTO ATENDIMENTO SANCTA MAGGIORE RUSSIA;PREVENT SENIOR PRIVATE OPERADORA DE SAUDE LTDA;HOSPITAL GERAL;HOSPITAL_PRIVADO;AVENIDA PROFESSOR FRANCISCO MORATO;1133;BUTANTA;5513100;33;0;0;0;0;0;0;0;0;0;0;0;0;0
202302;SUDESTE;SP;SAO PAULO;CRIA CASA DE PARTO;CENTRO DE PARTO HUMANIZADO VILA MARIANA EIRELI;HOSPITAL GERAL;HOSPITAL_PRIVADO;RUA DOUTOR LOPES DE ALMEIDA;16;VILA MARIANA;4120070;7;0;0;0;0;0;0;0;0;0;0;0;0;0
202302;SUDESTE;SP;SAO PAULO;PA SAO RAFAEL;PA SAO RAFAEL SERVICOS MEDICOS LTDA;PRONTO SOCORRO GERAL;HOSPITAL_PRIVADO;AVENIDA ADOLFO PINHEIRO;2100;SANTO AMARO;4734003;5;0;0;0;0;0;0;0;0;0;0;0;0;0
202302;SUDESTE;SP;SAO PAULO;HOSPITAL ESPORTE E SAUDE LTDA BR SURGERY;HOSPITAL ESPORTE E SAUDE LTDA;HOSPITAL GERAL;HOSPITAL_PRIVADO;AV FAGUNDES FILHO;475;VILA MONTE ALEGRE;4304010;14;0;2;0;2;0;0;0;0;0;0;0;0;0
202302;SUDESTE;SP;SAO PAULO;HOSPITAL VIDAS ALTA COMPLEXIDADE;HOSPITAL E MATERNIDADE VIDAS LTDA;HOSPITAL GERAL;HOSPITAL_PRIVADO;RUA PROFESSORA MARIA DE LOURDES DE SOUZA NOGUEIRA;89;VILA GEA;4692000;61;0;10;0;10;0;0;0;0;0;0;0;0;0
202302;SUDESTE;SP;SAO PAULO;HOSPITAL E PRONTO ATENDIMENTO SANCTA MAGGIORE PARIS;PREVENT SENIOR PRIVATE OPERADORA DE SAUDE LTDA;HOSPITAL GERAL;HOSPITAL_PRIVADO;RUA GENERAL CHAGAS SANTOS;314;VILA DA SAUDE;4146050;64;0;0;0;0;0;0;0;0;0;0;0;0;0
202302;SUDESTE;SP;SAO PAULO;SAO LUIZ MATERNIDADE;REDE DOR SAO LUIZ S A;HOSPITAL GERAL;HOSPITAL_PRIVADO;RUA HELENA;29;VILA OLIMPIA;4552050;230;0;58;0;0;0;0;0;58;0;0;0;0;0
202302;SUDESTE;SP;SAO PAULO;INSTITUTO DE INFECTOLOGIA EMILIO RIBAS SAO PAULO;SECRETARIA DE ESTADO DA SAUDE DE SAO PAULO;HOSPITAL GERAL;HOSPITAL_PÚBLICO;AV DR ARNALDO;165;CERQUEIRA CESAR;1246900;311;311;30;30;30;30;0;0;0;0;0;0;0;0
202302;SUDESTE;SP;SAO PAULO;PREVINA;PREVINA DIAGNOSTICOS MEDICOS S S LTDA;PRONTO SOCORRO GERAL;HOSPITAL_PRIVADO;AV RAIMUNDO PEREIRA DE MAGALHAES;12367;PARADA DE TAIPAS;2938000;10;0;10;0;10;0;0;0;0;0;0;0;0;0
202302;SUDESTE;SP;SAO PAULO;HOSPITAL DA LUZ 92;AMICO SAUDE LTDA;HOSPITAL GERAL;HOSPITAL_PRIVADO;RUA AZEVEDO MACEDO;92;VILA MARIANA;4013060;96;0;40;0;0;0;20;0;20;0;0;0;0;0
202302;SUDESTE;SP;SAO PAULO;HOSPITAL ISRAELITA ALBERT EINSTEIN;SOCIEDADE BENEFICENTE ISRAELITA BRAS HOSP ALBERT EINSTEIN;HOSPITAL GERAL;HOSPITAL_FILANTRÓPICO;AV ALBERT EINSTEIN;627;MORUMBI;5652900;669;38;94;10;54;10;18;0;22;0;0;0;0;0
202302;SUDESTE;SP;SAO PAULO;HOSPITAL DO SERV PUB EST FCO MORATO DE OLIVEIRA SAO PAULO;INSTITUTO DE ASSIST MEDICA DO SERVIDOR PUBLICO ESTADUAL SP;HOSPITAL GERAL;HOSPITAL_PÚBLICO;RUA PEDRO DE TOLEDO;1800;VILA CLEMENTINO;4029000;886;6;87;0;64;0;4;0;8;0;11;0;0;0
202302;SUDESTE;SP;SAO PAULO;HOSPITAL MATERNIDADE INTERLAGOS;SECRETARIA DE ESTADO DA SAUDE DE SAO PAULO;HOSPITAL ESPECIALIZADO;HOSPITAL_PÚBLICO;RUA LEONOR ALVIM;211;JD LEBLON;4802190;89;89;14;14;4;4;0;0;10;10;0;0;0;0
202302;SUDESTE;SP;SAO PAULO;HOSPITAL GERAL DE PEDREIRA;SECRETARIA DE ESTADO DA SAUDE DE SAO PAULO;HOSPITAL GERAL;HOSPITAL_PÚBLICO;RUA JOAO FRANCISCO DE MOURA;251;VILA CAMPO GRANDE;4455170;295;295;41;41;23;23;6;6;12;12;0;0;0;0
202302;SUDESTE;SP;SAO PAULO;HOSPITAL HELIOPOLIS UNIDADE DE GESTAO ASSISTENCIAL I SP;SECRETARIA DE ESTADO DA SAUDE DE SAO PAULO;HOSPITAL GERAL;HOSPITAL_PÚBLICO;RUA CONEGO XAVIER;276;SACOMA;4231030;290;290;24;24;24;24;0;0;0;0;0;0;0;0
202302;SUDESTE;SP;SAO PAULO;CAISM DR DAVID CAPISTRANO DA COSTA FILHO DA AGUA FUNDA SP;SECRETARIA DE ESTADO DA SAUDE DE SAO PAULO;HOSPITAL ESPECIALIZADO;HOSPITAL_PÚBLICO;AVENIDA MIGUEL STEFANO;3030;AGUA FUNDA;4301002;121;121;0;0;0;0;0;0;0;0;0;0;0;0
202302;SUDESTE;SP;SAO PAULO;HOSPITAL INFANTIL DARCY VARGAS UGA III SAO PAULO;SECRETARIA DE ESTADO DA SAUDE DE SAO PAULO;HOSPITAL ESPECIALIZADO;HOSPITAL_PÚBLICO;RUA DR SERAFICO DE ASSIS CARVALHO;34;JARDIM GUEDALA;4024002;122;122;14;14;0;0;9;9;5;5;0;0;0;0
202302;SUDESTE;SP;SAO PAULO;HC DA FMUSP INSTITUTO DO CORACAO INCOR SAO PAULO;FUNDACAO ZERBINI;HOSPITAL ESPECIALIZADO;HOSPITAL_FILANTRÓPICO;AVENIDA DR ENEAS DE CARVALHO AGUIAR;44;CERQUEIRA CESAR;5403000;445;390;145;145;119;119;23;23;3;3;0;0;0;0
202302;SUDESTE;SP;SAO PAULO;HOSP MUN MATERNIDADE PROFESSOR MARIO DEGNI;PREFEITURA DO MUNICIPIO DE SAO PAULO;HOSPITAL GERAL;HOSPITAL_PÚBLICO;RUA LUCAS DE LEYDE;257;VILA ANTONIO;5376010;73;62;16;9;10;4;0;0;6;5;0;0;0;0
202302;SUDESTE;SP;SAO PAULO;HOSP DA STA CASA DE STO AMARO;SANTA CASA DE MISERICORDIA DE SANTO AMARO;HOSPITAL GERAL;HOSPITAL_FILANTRÓPICO;RUA ISABEL SCHMIDT;59;SANTO AMARO;4743030;134;91;10;9;10;9;0;0;0;0;0;0;0;0
202302;SUDESTE;SP;SAO PAULO;HOSPITAL SAO LUIZ GONZAGA;IRMANDADE DA SANTA CASA DE MISERICORDIA DE SAO PAULO;HOSPITAL GERAL;HOSPITAL_FILANTRÓPICO;MICHEL OUCHANA;94;JACANA;2276140;171;157;6;0;0;0;0;0;6;0;0;0;0;0
202302;SUDESTE;SP;SAO PAULO;HOSPITAL UNIVERSITARIO DA USP SAO PAULO;HOSPITAL UNIVERSITARIO DA UNIVERSIDADE DE SAO PAULO;HOSPITAL GERAL;HOSPITAL_PÚBLICO;AV PROF LINEU PRESTES;2565;BUTANTA;5580000;206;206;28;28;12;12;10;10;6;6;0;0;0;0
202302;SUDESTE;SP;SAO PAULO;HOSPITAL OSWALDO CRUZ;HOSPITAL ALEMAO OSWALDO CRUZ;HOSPITAL GERAL;HOSPITAL_FILANTRÓPICO;RUA JOAO JULIAO;331;PARAISO;1323020;350;0;44;0;44;0;0;0;0;0;0;0;0;0
202302;SUDESTE;SP;SAO PAULO;CASA DA CRIANCA BETINHO;CASA DA CRIANCA BETINHO LAR ESPIRITA P EXCEPCIONAIS;HOSPITAL GERAL;HOSPITAL_FILANTRÓPICO;RUA VACANGA;300;VIL CARRAO;3433020;89;89;0;0;0;0;0;0;0;0;0;0;0;0
202302;SUDESTE;SP;SAO PAULO;HOSPITAL AMPARO MATERNAL;SPDM PAIS HOSPITAL AMPARO MATERNAL;HOSPITAL ESPECIALIZADO;HOSPITAL_FILANTRÓPICO;RUA LOEFGREEN;1901;V CLEMENTINO;4040032;110;105;10;10;0;0;0;0;10;10;0;0;0;0
202302;SUDESTE;SP;SAO PAULO;CAISM PHILIPPE PINEL SAO PAULO;SECRETARIA DE ESTADO DA SAUDE DE SAO PAULO;HOSPITAL ESPECIALIZADO;HOSPITAL_PÚBLICO;AV RAIMUNDO PEREIRA DE MAGALHAES;5214;PIRITUBA;2938000;136;136;0;0;0;0;0;0;0;0;0;0;0;0
202302;SUDESTE;SP;SAO PAULO;HOSPITAL ESTADUAL DE VILA ALPINA ORG SOCIAL SECONCI SAO PAUL;SECRETARIA DE ESTADO DA SAUDE DE SAO PAULO;HOSPITAL GERAL;HOSPITAL_PÚBLICO;AV FRANCISCO FALCONI;1501;VILA ALPINA;3227000;219;219;38;38;20;20;7;7;11;11;0;0;0;0
202302;SUDESTE;SP;SAO PAULO;HOSP MUN PIRITUBA JOSE SOARES HUNGRIA;SECRETARIA MUNICIPAL DA SAUDE;HOSPITAL GERAL;HOSPITAL_PÚBLICO;MENOTTI LAUDISIO;100;PIRITUBA;2945000;80;72;16;8;16;8;0;0;0;0;0;0;0;0
202302;SUDESTE;SP;SAO PAULO;HOSP DOM ALVARENGA;ASSOCIACAO BENEFICENTE NOSSA SENHORA DE NAZARE;HOSPITAL GERAL;HOSPITAL_FILANTRÓPICO;NAZARE;1361;IPIRANGA;4263200;149;75;30;0;30;0;0;0;0;0;0;0;0;0
202302;SUDESTE;SP;SAO PAULO;HOSPITAL SANTA MARCELINA SAO PAULO;CASA DE SAUDE SANTA MARCELINA;HOSPITAL GERAL;HOSPITAL_FILANTRÓPICO;RUA SANTA MARCELINA;177;ITAQUERA;8270070;671;530;117;84;98;65;10;10;9;9;0;0;0;0
202302;SUDESTE;SP;SAO PAULO;HOSPITAL SAO PAULO HOSPITAL DE ENSINO DA UNIFESP SAO PAULO;SPDM ASSOCIACAO PAULISTA PARA O DESENVOLVIMENTO DA MEDICINA;HOSPITAL GERAL;HOSPITAL_FILANTRÓPICO;RUA NAPOLEAO DE BARROS;715;VILA CLEMENTINO;4024002;842;798;117;114;77;74;19;19;17;17;4;4;0;0
202302;SUDESTE;SP;SAO PAULO;HOSPITAL GERAL DE SAO MATEUS SAO PAULO;SECRETARIA DE ESTADO DA SAUDE DE SAO PAULO;HOSPITAL GERAL;HOSPITAL_PÚBLICO;RUA ANGELO DE CANDIA;540;SAO MATEUS;3958000;251;251;49;49;24;24;10;10;10;10;5;5;0;0
202302;SUDESTE;SP;SAO PAULO;HOSPITAL LEFORTE LIBERDADE;HOSPITAL LEFORTE LIBERDADE S A;HOSPITAL GERAL;HOSPITAL_PRIVADO;RUA GALVAO BUENO;257;LIBERDADE;1506000;270;48;48;30;48;30;0;0;0;0;0;0;0;0
202302;SUDESTE;SP;SAO PAULO;UNIDADE DE GESTAO ASSISTENCIAL II HOSPITAL IPIRANGA SP;SECRETARIA DE ESTADO DA SAUDE SAO PAULO;HOSPITAL GERAL;HOSPITAL_PÚBLICO;AVENIDA NAZARE;28;IPIRANGA;4262000;314;314;32;32;22;22;0;0;10;10;0;0;0;0
202302;SUDESTE;SP;SAO PAULO;A C CAMARGO CANCER CENTER;FUNDACAO ANTONIO PRUDENTE;HOSPITAL ESPECIALIZADO;HOSPITAL_FILANTRÓPICO;RUA PROFESSOR ANTONIO PRUDENTE;211;LIBERDADE;1509900;355;209;40;28;30;22;10;6;0;0;0;0;0;0
202302;SUDESTE;SP;SAO PAULO;CONJUNTO HOSPITALAR DO MANDAQUI SAO PAULO;SECRETARIA DE ESTADO DA SAUDE DE SAO PAULO;HOSPITAL GERAL;HOSPITAL_PÚBLICO;RUA VOLUNTARIOS DA PATRIA;4301;SANTANA;2401400;419;419;65;65;47;47;8;8;10;10;0;0;0;0
202302;SUDESTE;SP;SAO PAULO;IBCC;INSTITUTO BRASILEIRO DE CONTROLE DO CANCER;HOSPITAL ESPECIALIZADO;HOSPITAL_FILANTRÓPICO;AV ALCANTARA MACHADO;2576;MOOCA;3102002;181;95;10;10;10;10;0;0;0;0;0;0;0;0
202302;SUDESTE;SP;SAO PAULO;HOSPITAL PRESIDENTE;HOSPITAL E MATERNIDADE PRESIDENTE SOCIEDADE SIMPLES;HOSPITAL GERAL;HOSPITAL_PRIVADO;AVENIDA NOVA CANTAREIRA;2398;TUCURUVI;2340000;122;0;20;0;20;0;0;0;0;0;0;0;0;0
202302;SUDESTE;SP;SAO PAULO;CENTRO INTEGR DE ASS E SAUDE NOSSA SENHORA DE FATIMA;CONGREGACAO DAS IRMAS HOSPITALEIRAS DO SAGRADO CORACAO DE JE;HOSPITAL ESPECIALIZADO;HOSPITAL_FILANTRÓPICO;JORNALISTA PAULO ZINGG;1078;PIRITUBA;5157030;190;0;0;0;0;0;0;0;0;0;0;0;0;0
202302;SUDESTE;SP;SAO PAULO;HOSPITAL GERAL SANTA MARCELINA DE ITAIM PAULISTA SAO PAULO;SECRETARIA DE ESTADO DA SAUDE DE SAO PAULO;HOSPITAL GERAL;HOSPITAL_PÚBLICO;AV MARECHAL TITO;6035;ITAIM PAULISTA;8115100;315;315;36;36;20;20;0;0;16;16;0;0;0;0
202302;SUDESTE;SP;SAO PAULO;HOSP MUN PROF DR WALDOMIRO DE PAULA;PREFEITURA DO MUNICIPIO DE SAO PAULO;HOSPITAL GERAL;HOSPITAL_PÚBLICO;RUA AUGUSTO CARLOS BAUMANN;1074;ITAQUERA;8210590;218;179;50;12;40;6;0;0;10;6;0;0;0;0
202302;SUDESTE;SP;SAO PAULO;ASSOC AACD V CLEMENTINO;ASSOCIACAO DE ASSISTENCIA A CRIANCA DEFICIENTE;HOSPITAL ESPECIALIZADO;HOSPITAL_FILANTRÓPICO;AVN PROF ASCENDINO REIS;724;VIL CLEMENTINO;4027000;87;27;10;4;5;2;5;2;0;0;0;0;0;0
202302;SUDESTE;SP;SAO PAULO;HOSPITAL GERAL DO GRAJAU PROF LIBER JOHN ALPHONSE DI DIO SP;SECRETARIA DE ESTADO DA SAUDE DE SAO PAULO;HOSPITAL GERAL;HOSPITAL_PÚBLICO;RUA FRANCISCO OCTAVIO PACCA;180;PARQUE DAS NACOES;4822030;260;254;44;38;24;24;9;8;11;6;0;0;0;0
202302;SUDESTE;SP;SAO PAULO;HOSPITAL E MATERNIDADE LEONOR MENDES DE BARROS SAO PAULO;SECRETARIA DE ESTADO DA SAUDE DE SAO PAULO;HOSPITAL ESPECIALIZADO;HOSPITAL_PÚBLICO;AV CELSO GARCIA;2477;BELENZINHO;3015000;167;167;20;20;6;6;0;0;14;14;0;0;0;0
202302;SUDESTE;SP;SAO PAULO;HOSP MONUMENTO CEHM;CENTRO DE ESTUDO DO HOSPITAL MONUMENTO;HOSPITAL GERAL;HOSPITAL_FILANTRÓPICO;RUA LIMA E SILVA;985;IPIRANGA;4215020;50;50;0;0;0;0;0;0;0;0;0;0;0;0
202302;SUDESTE;SP;SAO PAULO;CENTRO DE REFERENCIA E TREINAMENTO DST AIDS SAO PAULO;SECRETARIA DE ESTADO DA SAUDE DE SAO PAULO;HOSPITAL ESPECIALIZADO;HOSPITAL_PÚBLICO;RUA SANTA CRUZ;81;VILA MARIANA;4121000;46;46;0;0;0;0;0;0;0;0;0;0;0;0
202302;SUDESTE;SP;SAO PAULO;HC DA FMUSP HOSPITAL DAS CLINICAS SAO PAULO;FUNDACAO FACULDADE DE MEDICINA MEC MPAS;HOSPITAL GERAL;HOSPITAL_FILANTRÓPICO;RUA DR OVIDIO PIRES DE CAMPOS;225;CERQUEIRA CESAR;5403010;1543;1476;227;225;128;128;53;51;40;40;6;6;0;0
202302;SUDESTE;SP;SAO PAULO;HOSPITAL E MATERNIDADE METROPOLITANO;AMICO SAUDE LTDA;HOSPITAL GERAL;HOSPITAL_PRIVADO;MARCELINA;441;VILA ROMANA;5044010;88;0;73;0;46;0;9;0;18;0;0;0;0;0
202302;SUDESTE;SP;SAO PAULO;CENTRO DE REFERENCIA DA SAUDE DA MULHER SAO PAULO;SECRETARIA DE ESTADO DA SAUDE DE SAO PAULO;HOSPITAL ESPECIALIZADO;HOSPITAL_PÚBLICO;AV RIO BRANCO;1080;CAMPOS ELISEOS;1206001;139;139;7;7;7;7;0;0;0;0;0;0;0;0
202302;SUDESTE;SP;SAO PAULO;HOSP MUN INFANTIL MENINO JESUS;PREFEITURA DO MUNICIPIO DE SAO PAULO;HOSPITAL ESPECIALIZADO;HOSPITAL_PÚBLICO;RUA DOS INGLESES;258;BELA VISTA;1329000;103;59;20;10;0;0;20;10;0;0;0;0;0;0
202302;SUDESTE;SP;SAO PAULO;HOSP INDEPENDENCIA;HOSPITAL INDEPENDENCIA ZONA LESTE LTDA;HOSPITAL GERAL;HOSPITAL_PRIVADO;RUA URUCURANA;1;JARDIM PEDRO JOSE NU;8061100;103;0;14;0;10;0;0;0;4;0;0;0;0;0
202302;SUDESTE;SP;SAO PAULO;HOSPITAL SANTA VIRGINIA;ASSOCIACAO HOSPITALAR FILHAS DE N S DO MONTE CALVARIO;HOSPITAL GERAL;HOSPITAL_FILANTRÓPICO;AVENIDA CELSO GARCIA;2294;BELEM;3014000;93;0;13;0;13;0;0;0;0;0;0;0;0;0
202302;SUDESTE;SP;SAO PAULO;HOSPITAL AVICCENA;REDE DOR SAO LUIZ S A;HOSPITAL GERAL;HOSPITAL_PRIVADO;PADRE ADELINO;901;IV PARADA;3303000;96;0;28;0;28;0;0;0;0;0;0;0;0;0
202302;SUDESTE;SP;SAO PAULO;HOSPITAL CANTAREIRA;SPDM ASSOC PAULISTA PARA O DESENVOLVIMENTO DA MEDICINA;HOSPITAL GERAL;HOSPITAL_FILANTRÓPICO;AV NOVA CANTAREIRA;3050;TUCURUVI;2340000;114;100;0;0;0;0;0;0;0;0;0;0;0;0
202302;SUDESTE;SP;SAO PAULO;HOSPITAL E MATERNIDADE SANTA MARIA CRUZ AZUL;CRUZ AZUL DE SAO PAULO;HOSPITAL GERAL;HOSPITAL_FILANTRÓPICO;LINS DE VASCONCELOS;356;CAMBUCI;1538900;347;1;68;0;50;0;18;0;0;0;0;0;0;0
202302;SUDESTE;SP;SAO PAULO;UNIDADE REFERENCIADA OSWALDO CRUZ VERGUEIRO;HOSPITAL ALEMAO OSWALDO CRUZ;HOSPITAL GERAL;HOSPITAL_FILANTRÓPICO;R VERGUEIRO;17;LIBERDADE;1504000;232;38;30;10;30;10;0;0;0;0;0;0;0;0
202302;SUDESTE;SP;SAO PAULO;HOSP DA AERONAUTICA DE SPHASP;COMANDO DA AERONAUTICA;HOSPITAL GERAL;HOSPITAL_PÚBLICO;OLAVO FONTOURA;1400;SANTANA;2012021;58;0;9;0;9;0;0;0;0;0;0;0;0;0
202302;SUDESTE;SP;SAO PAULO;HOSPITAL E MATERNIDADE SAO MIGUEL;HOSPITAL E MATERNIDADE SAO MIGUEL SA;HOSPITAL GERAL;HOSPITAL_PRIVADO;RUA LUIS PICOLO;11;SAO MIGUEL;8010320;75;0;0;0;0;0;0;0;0;0;0;0;0;0
202302;SUDESTE;SP;SAO PAULO;DAY HOSPITAL DE ERMELINO MATARAZZO;DAY HOSPITAL DE ERMELINO MATARAZZO SC LTDA;HOSPITAL GERAL;HOSPITAL_PRIVADO;AV ABEL TAVARES;2576;ERMELINO MATARAZZO;3810110;68;0;9;0;9;0;0;0;0;0;0;0;0;0
202302;SUDESTE;SP;SAO PAULO;HOSPITAL ITAQUERA;GRUPO ITASA LIFE LTDA;HOSPITAL GERAL;HOSPITAL_PRIVADO;RUA JOSE OITICICA FILHO;123;ITAQUERA;8210510;120;0;10;0;10;0;0;0;0;0;0;0;0;0
202302;SUDESTE;SP;SAO PAULO;HOSP 9 DE JULHO;HOSPITAL 9 DE JULHO SA;HOSPITAL GERAL;HOSPITAL_PRIVADO;RUA PEIXOTO GOMIDE;625;BELA VISTA;1409902;224;0;44;0;44;0;0;0;0;0;0;0;0;0
202302;SUDESTE;SP;SAO PAULO;HOSPITAL SIRIO LIBANES;SOCIEDADE BENEFICENTE DE SENHORAS HOSPITAL SIRIO LIBANES;HOSPITAL GERAL;HOSPITAL_FILANTRÓPICO;RUA DONA ADMA JAFET;91;CERQUEIRA CESAR;1308050;469;14;102;0;30;0;6;0;0;0;0;0;66;0
202302;SUDESTE;SP;SAO PAULO;HOSP MUN MAT ESC DR MARIO DE MORAES A SILVA;PREFEITURA DO MUNICIPIO DE SAO PAULO;HOSPITAL ESPECIALIZADO;HOSPITAL_PÚBLICO;AV DEP EMILIO CARLOS;3100;VL NOVA CACHOEIRINHA;2720200;192;192;37;37;7;7;0;0;30;30;0;0;0;0
202302;SUDESTE;SP;SAO PAULO;HOSPITAL GERAL JESUS TEIXEIRA DA COSTA GUAIANASES SAO PAULO;SECRETARIA DE ESTADO DA SAUDE DE SAO PAULO;HOSPITAL GERAL;HOSPITAL_PÚBLICO;AV MIGUEL ACHIOLE DA FONSECA;135;JARDIM SAO PAULO;8461110;253;249;28;28;20;20;0;0;8;8;0;0;0;0
202302;SUDESTE;SP;SAO PAULO;HOSPITAL SANTA ISABEL;HOSPITAL SANTA ISABEL;HOSPITAL GERAL;HOSPITAL_FILANTRÓPICO;R DONA VERIDIANA;311;VILA BUARQUE;1238010;103;2;25;0;25;0;0;0;0;0;0;0;0;0
202302;SUDESTE;SP;SAO PAULO;MATERNIDADE SANTA JOANA;HOSPITAL E MATERNIDADE SANTA JOANA SA;HOSPITAL ESPECIALIZADO;HOSPITAL_PRIVADO;RUA DO PARAISO;432;PARAISO;4103000;388;0;123;0;5;0;0;0;118;0;0;0;0;0
202302;SUDESTE;SP;SAO PAULO;INSTITUTO DO CANCER ARNALDO VIEIRA DE CARVALHO;INSTITUTO DO CANCER ARNALDO VIEIRA DE CARVALHO;HOSPITAL ESPECIALIZADO;HOSPITAL_FILANTRÓPICO;RUA DR CESARIO MOTA JUNIOR;112;VILA BUARQUE;1221020;80;80;8;8;8;8;0;0;0;0;0;0;0;0
202302;SUDESTE;SP;SAO PAULO;HOSPITAL DA CRIANCA;REDE DOR SAO LUIZ S A;HOSPITAL ESPECIALIZADO;HOSPITAL_PRIVADO;RUA DAS PEROBAS;295;JABAQUARA;4321120;71;0;20;0;20;0;0;0;0;0;0;0;0;0
202302;SUDESTE;SP;SAO PAULO;HOSP MUN DR CARMINO CARICCHIO;PREFEITURA DO MUNICIPIO DE SAO PAULO;HOSPITAL GERAL;HOSPITAL_PÚBLICO;AV CELSO GARCIA;4815;TATUAPE;3063000;392;385;82;75;58;58;10;7;10;6;4;4;0;0
202302;SUDESTE;SP;SAO PAULO;HOSPITAL DA CRUZ VERMELHA BRASILEIRA;CRUZ VERMELHA BRASILEIRA FILIAL DO ESTADO DE SAO PAULO;HOSPITAL GERAL;HOSPITAL_FILANTRÓPICO;AVENIDA MOREIRA GUIMARAES;699;INDIANOPOLIS;4074031;40;0;0;0;0;0;0;0;0;0;0;0;0;0
202302;SUDESTE;SP;SAO PAULO;HOSPITAL BP;REAL E BENEMERITA ASSOCIACAO PORTUGUESA DE BENEFICENCIA;HOSPITAL GERAL;HOSPITAL_FILANTRÓPICO;MAEST CARDIM;769;LIBERDADE;1323900;887;252;243;65;195;50;48;15;0;0;0;0;0;0
202302;SUDESTE;SP;SAO PAULO;HOSP MUN TIDE SETUBAL;PREFEITURA DO MUNICIPIO DE SAO PAULO;HOSPITAL GERAL;HOSPITAL_PÚBLICO;RUA DR JOSE GUILHERME EIRAS;123;SAO MIGUEL PAULISTA;8010220;204;192;44;32;29;17;10;10;5;5;0;0;0;0
202302;SUDESTE;SP;SAO PAULO;HOSP MUN V NHOCUNE ALEXANDRE ZAIO;SECRETARIA MUNICIPAL DA SAUDE;HOSPITAL GERAL;HOSPITAL_PÚBLICO;ALVES MALDONADO;S/N;VILA NHOCUNE;3558050;48;48;0;0;0;0;0;0;0;0;0;0;0;0
202302;SUDESTE;SP;SAO PAULO;HOSP MAT SAO CRISTOVAO;ASSOCIACAO DE BENEFICENCIA E FILANTROPIA SAO CRISTOVAO;HOSPITAL GERAL;HOSPITAL_FILANTRÓPICO;AMERICO VENTURA;123;ALTO DA MOOCA;3128020;302;0;50;0;30;0;10;0;10;0;0;0;0;0
202302;SUDESTE;SP;SAO PAULO;HOSPITAL SAMARITANO;ESHO EMPRESA DE SERVICOS HOSPITALARES S A;HOSPITAL GERAL;HOSPITAL_PRIVADO;RUA CONS BROTERO;1486;HIGIENOPOLIS;1232010;314;0;73;0;48;0;15;0;10;0;0;0;0;0
202302;SUDESTE;SP;SAO PAULO;HOSP PAULISTA DE OTORRINOLARINGOLOGIA;HOSPITAL PAULISTA LTDA;HOSPITAL ESPECIALIZADO;HOSPITAL_PRIVADO;RUA DR DIOGO DE FARIA;780;VIL CLEMENTINO;4037002;44;0;2;0;1;0;1;0;0;0;0;0;0;0
202302;SUDESTE;SP;SAO PAULO;HOSPITAL DO CORACAO;ASSOCIACAO BENEFICENTE SIRIA;HOSPITAL GERAL;HOSPITAL_FILANTRÓPICO;RUA DESEMBARGADOR ELISEU GUILHERME;123;PARAISO;4004030;292;5;65;0;36;0;12;0;4;0;0;0;13;0
202302;SUDESTE;SP;SAO PAULO;HOSPITAL SBC;ASSOCIACAO DE ASSISTENCIA MUTUA A SAUDE SBC;HOSPITAL GERAL;HOSPITAL_FILANTRÓPICO;BLUMENAU;320;V LEOPOLDINA;5319020;27;0;0;0;0;0;0;0;0;0;0;0;0;0
202302;SUDESTE;SP;SAO PAULO;HOSP MUN JABAQUARA ARTUR RIBEIRO DE SABOYA;SECRETARIA MUNICIPAL DA SAUDE;HOSPITAL GERAL;HOSPITAL_PÚBLICO;FRANCISCO DE PAULA QUINTANILHA RIBEIRO;860;JABAQUARA;4330902;200;200;33;33;21;21;8;8;4;4;0;0;0;0
202302;SUDESTE;SP;SAO PAULO;HOSPITAL KATIA DE SOUZA RODRIGUES TAIPAS SAO PAULO;SECRETARIA DE ESTADO DA SAUDE DE SAO PAULO;HOSPITAL GERAL;HOSPITAL_PÚBLICO;AV ELISIO TEIXEIRA LEITE;6999;PARADA DE TAIPAS;2810000;285;252;46;29;20;10;14;13;12;6;0;0;0;0
202302;SUDESTE;SP;SAO PAULO;HOSP ALBERT SABIN;LAPA ASSISTENCIA MEDICA LTDA;HOSPITAL GERAL;HOSPITAL_PRIVADO;RUA BRIGADEIRO GAVIAO PEIXOTO;123;LAPA;5078000;74;0;25;0;16;0;0;0;0;0;0;0;9;0
202302;SUDESTE;SP;SAO PAULO;HOSPITAL SANTA RITA;CASA DE SAUDE SANTA RITA S A;HOSPITAL GERAL;HOSPITAL_PRIVADO;RUA CUBATAO;1190;VILA MARIANA;4013004;132;0;12;0;12;0;0;0;0;0;0;0;0;0
202302;SUDESTE;SP;SAO PAULO;HOSPITAL JAPONES SANTA CRUZ;SOCIEDADE BRASILEIRA E JAPONESA DE BENEFICIENCIA SANTA CRUZ;HOSPITAL GERAL;HOSPITAL_FILANTRÓPICO;R SANTA CRUZ;398;VILA MARIANA;4122000;168;30;30;10;30;10;0;0;0;0;0;0;0;0
202302;SUDESTE;SP;SAO PAULO;HOSP MUN PROFESSOR DOUTOR ALIPIO CORREA NETTO;PREFEITURA DO MUNICIPIO DE SAO PAULO;HOSPITAL GERAL;HOSPITAL_PÚBLICO;ALAMEDA RODRIGO DE BRUM;1989;VILA PARANAGUA;3807230;286;256;50;44;30;30;10;6;10;8;0;0;0;0
202302;SUDESTE;SP;SAO PAULO;HOSPITAL MUNICIPAL DR BENEDICTO MONTENEGRO;PREFEITURA DO MUNICIPIO DE SAO PAULO;HOSPITAL GERAL;HOSPITAL_PÚBLICO;ANTONIO LAZARO;226;JARDIM IVA;3921080;54;45;8;0;8;0;0;0;0;0;0;0;0;0
202302;SUDESTE;SP;SAO PAULO;HOSP IGESP;IGESP SA CENTRO MEDICO E CIRURGICO INST GASTROENT DE SP;HOSPITAL GERAL;HOSPITAL_PRIVADO;SILVIA;276;BELA VISTA;1331010;160;0;0;0;0;0;0;0;0;0;0;0;0;0
202302;SUDESTE;SP;SAO PAULO;HOSPITAL E MATERNIDADE NOSSA SENHORA DO ROSARIO;NOTRE DAME INTERMEDICA SAUDE S A;HOSPITAL GERAL;HOSPITAL_PRIVADO;DR EDSON DE MELO;357;VILA MARIA ALTA;2122080;73;0;20;0;10;0;0;0;10;0;0;0;0;0
202302;SUDESTE;SP;SAO PAULO;HOSPITAL PAULISTANO;ESHO EMPRESA DE SERVICOS HOSPITALARES S A;HOSPITAL GERAL;HOSPITAL_PRIVADO;RUA MARTINIANO DE CARVALHO;741;BELA VISTA;1321001;165;0;20;0;20;0;0;0;0;0;0;0;0;0
202302;SUDESTE;SP;SAO PAULO;HOSP MUN DR IGNACIO PROENCA DE GOUVEA;PREFEITURA DO MUNICIPIO DE SAO PAULO;HOSPITAL GERAL;HOSPITAL_PÚBLICO;RUA JUVENTUS;562;MOOCA;3124020;128;111;33;16;25;12;0;0;8;4;0;0;0;0
202302;SUDESTE;SP;SAO PAULO;INSTITUTO DANTE PAZZANESE DE CARDIOLOGIA IDPC SAO PAULO;FUNDACAO ADIB JATENE;HOSPITAL ESPECIALIZADO;HOSPITAL_FILANTRÓPICO;AV DR DANTE PAZZANESE;500;IBIRAPUERA;4012180;402;386;103;100;82;80;21;20;0;0;0;0;0;0
202302;SUDESTE;SP;SAO PAULO;HOSPITAL INFANTIL CANDIDO FONTOURA SAO PAULO;SECRETARIA DE ESTADO DA SAUDE DE SAO PAULO;HOSPITAL ESPECIALIZADO;HOSPITAL_PÚBLICO;RUA SIQUEIRA BUENO;1757;AGUA RASA;3173010;126;120;26;26;0;0;20;20;6;6;0;0;0;0
202302;SUDESTE;SP;SAO PAULO;HOSPITAL DE TRANSP DO EST DE SP EURYCLIDES DE JESUS ZERBINI;SECRETARIA DE ESTADO DA SAUDE DE SAO PAULO;HOSPITAL GERAL;HOSPITAL_PÚBLICO;AV BRIGADEIRO LUIZ ANTONIO;2651;JARDIM PAULISTA;1401901;168;168;21;21;16;16;5;5;0;0;0;0;0;0
202302;SUDESTE;SP;SAO PAULO;HOSP RUBEM BERTA;ADLM SERVICOS MEDICOS LTDA;HOSPITAL ESPECIALIZADO;HOSPITAL_PRIVADO;RUBEM BERTA;1100;INDIANOPOLIS;4074000;57;0;1;0;1;0;0;0;0;0;0;0;0;0
202302;SUDESTE;SP;SAO PAULO;CASA DE SAUDE DE SAO JOAO DE DEUS;ASSOCIACAO HOSPITALEIRA DE ASSISTENCIA SOCIAL;HOSPITAL ESPECIALIZADO;HOSPITAL_FILANTRÓPICO;EST TURISTICA DO JARAGUA;2365;PIRITUBA;5161000;144;0;0;0;0;0;0;0;0;0;0;0;0;0
202302;SUDESTE;SP;SAO PAULO;HOSPITAL ALVORADA MOEMA;HOSPITAL ALVORADA TAGUATINGA LTDA;HOSPITAL GERAL;HOSPITAL_PRIVADO;AVENIDA IBIRAPUERA;1942;INDIANOPOLIS;4028001;182;0;30;0;20;0;10;0;0;0;0;0;0;0
202302;SUDESTE;SP;SAO PAULO;HOSPITAL E MATERNIDADE SAO RAFAEL SP;CENTRO MEDICO ESPECIALIZADO S C LTDA;HOSPITAL GERAL;HOSPITAL_PRIVADO;ECA DE QUEIROZ;391;VILA MARIANA;4011032;59;0;3;0;3;0;0;0;0;0;0;0;0;0
202302;SUDESTE;SP;SAO PAULO;HOSP MAT 8 DE MAIO;HOSPITAL E MATERNIDADE 8 DE MAIO LTDA;HOSPITAL GERAL;HOSPITAL_PRIVADO;RUA RAFAEL MONTEIRO VALEIRO;18;ITAIM PAULISTA;8140020;28;0;0;0;0;0;0;0;0;0;0;0;0;0
202302;SUDESTE;SP;SAO PAULO;ASSOC CRUZ VERDE;ASSOCIACAO CRUZ VERDE;HOSPITAL ESPECIALIZADO;HOSPITAL_FILANTRÓPICO;RUA DR DIOGO DE FARIA;695;VILA CLEMENTINO;4037002;204;204;0;0;0;0;0;0;0;0;0;0;0;0
202302;SUDESTE;SP;SAO PAULO;HOSPITAL SANTA PAULA;HOSPITAL SANTA PAULA S A;HOSPITAL GERAL;HOSPITAL_PRIVADO;AVENIDA SANTO AMARO;2468;VILA OLIMPIA;4556100;199;0;50;0;50;0;0;0;0;0;0;0;0;0
202302;SUDESTE;SP;SAO PAULO;HOSPITAL SAO LUIZ JABAQUARA;REDE DOR SAO LUIZ S A;HOSPITAL GERAL;HOSPITAL_PRIVADO;RUA DAS PEROBAS;344;JABAQUARA;4321120;159;0;50;0;50;0;0;0;0;0;0;0;0;0
202302;SUDESTE;SP;SAO PAULO;HOSPITAL SEPACO;SERV SOCIAL DA IND DO PAPEL PAPELAO E CORT DO ESTADO DE SP;HOSPITAL GERAL;HOSPITAL_FILANTRÓPICO;VERGUEIRO;4210;VILA MARIANA;4102900;259;19;100;0;40;0;30;0;30;0;0;0;0;0
202302;SUDESTE;SP;SAO PAULO;HOSP EDMUNDO VASCONCELOS;FUNDACAO INST DE MOLESTIAS DO APARELHO DIGEST E DA NUTRICAO;HOSPITAL GERAL;HOSPITAL_FILANTRÓPICO;RUA BORGES LAGOA;1450;VIL CLEMENTINO;4038905;157;0;17;0;10;0;7;0;0;0;0;0;0;0
202302;SUDESTE;SP;SAO PAULO;HOSPITAL NEXT BUTANTA;HOSPITAL ALVORADA TAGUATINGA LTDA;HOSPITAL GERAL;HOSPITAL_PRIVADO;AV PROF FRANCISCO MORATO;719;BUTANTA;5513000;128;0;20;0;20;0;0;0;0;0;0;0;0;0
202302;SUDESTE;SP;SAO PAULO;HOSP PS NOVA IGUATEMI;HOSPITAL PS NOVA IGUATEMI SC LTDA;HOSPITAL GERAL;HOSPITAL_PRIVADO;AVN RAGUEB CHOHFI;3315;SAO MATEUS;8375000;15;0;0;0;0;0;0;0;0;0;0;0;0;0
202302;SUDESTE;SP;SAO PAULO;HOSPITAL GRAACC INSTITUTO DE ONCOLOGIA PEDIATRICA IOP;GRUPO DE APOIO AO ADOLESCENTE E A CRIANCA COM CANCER GRAAC;HOSPITAL ESPECIALIZADO;HOSPITAL_FILANTRÓPICO;RUA PEDRO DE TOLEDO;572;VILA CLEMENTINO;4039001;73;59;10;8;0;0;10;8;0;0;0;0;0;0
202302;SUDESTE;SP;SAO PAULO;HOSPITAL NIPO BRASILEIRO;BENEFICENCIA NIPO BRASILEIRA DE SAO PAULO;HOSPITAL GERAL;HOSPITAL_FILANTRÓPICO;RUA PISTOIA;100;PARQUE NOVO MUNDO;2189000;242;0;52;0;23;0;0;0;17;0;0;0;12;0
202302;SUDESTE;SP;SAO PAULO;HOSPITAL DO RIM E HIPERTENSAO;FUNDACAO OSWALDO RAMOS;HOSPITAL ESPECIALIZADO;HOSPITAL_FILANTRÓPICO;RUA BORGES LAGOA;960;VILA CLEMENTINO;4038002;151;146;16;16;16;16;0;0;0;0;0;0;0;0
202302;SUDESTE;SP;SAO PAULO;HOSPITAL REGIONAL SUL SAO PAULO;SECRETARIA DE ESTADO DA SAUDE SAO PAULO;HOSPITAL GERAL;HOSPITAL_PÚBLICO;RUA GENERAL ROBERTO ALVES DE CARVALHO FILHO;270;SANTO AMARO;4744000;212;209;34;31;17;14;7;7;10;10;0;0;0;0
202302;SUDESTE;SP;SAO PAULO;HOSPITAL VITAL BRAZIL SAO PAULO;INSTITUTO BUTANTAN;HOSPITAL ESPECIALIZADO;HOSPITAL_PÚBLICO;AV VITAL BRAZIL;1500;BUTANTA;5503900;11;11;0;0;0;0;0;0;0;0;0;0;0;0
202302;SUDESTE;SP;SAO PAULO;ASSOCIACAO NOSSA SENHORA DO PARI;ASSOCIACAO BENEFICENTE DE ASSISTENCIA SOCIAL N SRA DO PARI;HOSPITAL ESPECIALIZADO;HOSPITAL_FILANTRÓPICO;RUA HANEMANN;234;CANINDE;3031040;54;53;8;7;8;7;0;0;0;0;0;0;0;0
202302;SUDESTE;SP;SAO PAULO;INST CEMA DE OFTALMOLOGIA E OTORRINOLARINGOLOGIA;INST CEMA DE OFTALMOLOGIA E OTORRINOLARINGOLOGIA;HOSPITAL GERAL;HOSPITAL_FILANTRÓPICO;RUA PASCOAL MOREIRA;450;MOOCA;3117000;31;31;0;0;0;0;0;0;0;0;0;0;0;0
202302;SUDESTE;SP;SAO PAULO;HOSPITAL ESTADUAL DE SAPOPEMBA SAO PAULO;SECRETARIA DE ESTADO DA SAUDE DE SAO PAULO;HOSPITAL GERAL;HOSPITAL_PÚBLICO;RUA MANOEL FRANCA DOS SANTOS;174;JARDIM SAPOPEMBA;3975130;162;162;30;30;20;20;0;0;10;10;0;0;0;0
